codename,name,role,emoji,specialty
design-chief,DESIGN Chief,Orquestrador interno da squad,📐,"Roteamento por formato, briefing técnico, consolidação de entregáveis visuais"
diretor-arte,Diretor de Arte,Estratégia visual e narrative voice,🎬,"Mood, paleta, hierarquia visual, direção criativa adaptada ao nicho do cliente"
designer-carrossel,Designer de Carrossel,Especialista em carrossel multi-card,🃏,"Storytelling visual em 5-10 cards, ritmo de leitura, transições"
designer-estatico,Designer Estático,Especialista em peças únicas,🖼️,"Feed 1:1, 4:5, GMB posts, Stories cover, alta conversão em 1 frame"
designer-video,Designer de Vídeo Curto,Especialista em Reels e Stories video,🎥,"Reels 15-30s, hook visual, ritmo, motion design"
visual-researcher,Visual Researcher,Mining de refs de criativos winners,🔍,"Meta Ads Library, Pinterest, refs específicas do nicho do cliente"
ai-generator,AI Image/Video Generator,Geração de assets via IA,🤖,"FLUX, Nano Banana, Veo, Qwen, Ideogram — owner do fal.ai gateway + Pillow composition"
